{
  "comment": "granted L3 >= required L2 -> language-determined auto -> act.",
  "activations": [
    {
      "actor": "bot",
      "source": "decide",
      "token": {
        "id": "t1",
        "kind": "act",
        "risk": "low",
        "party": "deployer",
        "provenance": []
      }
    }
  ],
  "expected": {
    "decide": {
      "verdict": "auto",
      "master": "act"
    }
  },
  "log": [
    {
      "gate": "decide",
      "verdict": "auto"
    }
  ]
}
