{
  "comment": "granted L1 < required L3 -> language-determined human -> withhold.",
  "activations": [
    {
      "actor": "bot",
      "source": "decide",
      "token": {
        "id": "t1",
        "kind": "act",
        "risk": "low",
        "party": "deployer",
        "provenance": []
      }
    }
  ],
  "expected": {
    "decide": {
      "verdict": "human",
      "master": "withhold"
    }
  },
  "log": [
    {
      "gate": "decide",
      "verdict": "human"
    }
  ]
}
