{
  "comment": "A reserved kind with a duration window -> reserved -> withhold; duration + on_elapse are projected (halt and proceed).",
  "activations": [
    {
      "actor": "a",
      "source": "decide",
      "token": {
        "id": "t",
        "kind": "loans",
        "risk": "high",
        "party": "p",
        "provenance": []
      }
    }
  ],
  "expected": {
    "decide": {
      "verdict": "reserved",
      "master": "withhold"
    }
  },
  "log": [
    {
      "gate": "decide",
      "verdict": "reserved"
    }
  ]
}
