{
  "comment": "One activation at A. A pipes to B and to C; B also pipes to C. The pipe topology alone forces the order A, B, C (A has no predecessor, B depends only on A, C depends on both). C alone egresses; a granted at all three; the master acts once, at C.",
  "activations": [
    {"actor": "a", "source": "A", "token": {"id": "t1", "kind": "routine", "risk": "low", "party": "controller", "provenance": []}}
  ],
  "expected": {
    "A": {"verdict": "auto"},
    "B": {"verdict": "auto"},
    "C": {"verdict": "auto", "master": "act"}
  },
  "log": [
    {"gate": "A", "verdict": "auto"},
    {"gate": "B", "verdict": "auto"},
    {"gate": "C", "verdict": "auto"}
  ]
}
